{
  "system": "acme-shop",
  "language": "typescript",
  "framework": "nestjs",
  "captured": "by hand, 2026-10-30",
  "endpoints": [
    { "id": "@acme/api:GET:/users", "method": "GET", "path": "/users", "entry": "@acme/api:UsersController", "kind": "http", "protocol": "http", "module": "@acme/api", "file": "apps/api/src/users/users.controller.ts", "line": 21 },
    { "id": "@acme/api:GET:/users/:id", "method": "GET", "path": "/users/:id", "entry": "@acme/api:UsersController", "kind": "http", "protocol": "http", "module": "@acme/api", "file": "apps/api/src/users/users.controller.ts", "line": 27 },
    { "id": "@acme/api:POST:/users", "method": "POST", "path": "/users", "entry": "@acme/api:UsersController", "kind": "http", "protocol": "http", "module": "@acme/api", "file": "apps/api/src/users/users.controller.ts", "line": 33 },
    { "id": "@acme/api:PATCH:/users/:id", "method": "PATCH", "path": "/users/:id", "entry": "@acme/api:UsersController", "kind": "http", "protocol": "http", "module": "@acme/api", "file": "apps/api/src/users/users.controller.ts", "line": 40 },
    { "id": "@acme/api:DELETE:/users/:id", "method": "DELETE", "path": "/users/:id", "entry": "@acme/api:UsersController", "kind": "http", "protocol": "http", "module": "@acme/api", "file": "apps/api/src/users/users.controller.ts", "line": 47 },
    { "id": "@acme/api:GET:/orders", "method": "GET", "path": "/orders", "entry": "@acme/api:OrdersController", "kind": "http", "protocol": "http", "module": "@acme/api", "file": "apps/api/src/orders/orders.controller.ts", "line": 18 },
    { "id": "@acme/api:POST:/orders", "method": "POST", "path": "/orders", "entry": "@acme/api:OrdersController", "kind": "http", "protocol": "http", "module": "@acme/api", "file": "apps/api/src/orders/orders.controller.ts", "line": 24 },
    { "id": "@acme/api:POST:/orders/:id/cancel", "method": "POST", "path": "/orders/:id/cancel", "entry": "@acme/api:OrdersController", "kind": "http", "protocol": "http", "module": "@acme/api", "file": "apps/api/src/orders/orders.controller.ts", "line": 31 },
    { "id": "@acme/api:GET:/orders/:orderId/items/:itemId/attachments/:attachmentId/download", "method": "GET", "path": "/orders/:orderId/items/:itemId/attachments/:attachmentId/download", "entry": "@acme/api:OrdersController", "kind": "http", "protocol": "http", "module": "@acme/api", "file": "apps/api/src/orders/orders.controller.ts", "line": 38 },
    { "id": "@acme/api:POST:/auth/login", "method": "POST", "path": "/auth/login", "entry": "@acme/api:AuthController", "kind": "http", "protocol": "http", "module": "@acme/api", "file": "apps/api/src/auth/auth.controller.ts", "line": 14 },
    { "id": "@acme/api:POST:/auth/refresh", "method": "POST", "path": "/auth/refresh", "entry": "@acme/api:AuthController", "kind": "http", "protocol": "http", "module": "@acme/api", "file": "apps/api/src/auth/auth.controller.ts", "line": 22 },
    { "id": "@acme/api:GRAPHQL:Query.products", "method": "GRAPHQL", "path": "Query.products", "entry": "@acme/api:CatalogueResolver", "kind": "graphql", "protocol": "graphql", "module": "@acme/api", "file": "apps/api/src/catalogue/catalogue.resolver.ts", "line": 16 },
    { "id": "@acme/api:GRAPHQL:Mutation.updateProduct", "method": "GRAPHQL", "path": "Mutation.updateProduct", "entry": "@acme/api:CatalogueResolver", "kind": "graphql", "protocol": "graphql", "module": "@acme/api", "file": "apps/api/src/catalogue/catalogue.resolver.ts", "line": 24 },
    { "id": "@acme/api:WS:orders.subscribe", "method": "WS", "path": "orders.subscribe", "entry": "@acme/api:EventsGateway", "kind": "websocket", "protocol": "socket.io", "module": "@acme/api", "file": "apps/api/src/events/events.gateway.ts", "line": 19 },
    { "id": "@acme/orders-service:GRPC:orders.OrdersService/CreateOrder", "method": "GRPC", "path": "orders.OrdersService/CreateOrder", "entry": "@acme/orders-service:OrdersGrpcController", "kind": "grpc", "protocol": "grpc", "module": "@acme/orders-service", "file": "apps/orders-service/src/orders/orders.grpc.controller.ts", "line": 17 },
    { "id": "@acme/orders-service:GRPC:orders.OrdersService/GetOrder", "method": "GRPC", "path": "orders.OrdersService/GetOrder", "entry": "@acme/orders-service:OrdersGrpcController", "kind": "grpc", "protocol": "grpc", "module": "@acme/orders-service", "file": "apps/orders-service/src/orders/orders.grpc.controller.ts", "line": 25 },
    { "id": "@acme/orders-service:GRPC:orders.OrdersService/ListOrdersForCustomerWithExtendedPaginationAndFilters", "method": "GRPC", "path": "orders.OrdersService/ListOrdersForCustomerWithExtendedPaginationAndFilters", "entry": "@acme/orders-service:OrdersGrpcController", "kind": "grpc", "protocol": "grpc", "module": "@acme/orders-service", "file": "apps/orders-service/src/orders/orders.grpc.controller.ts", "line": 31 },
    { "id": "@acme/orders-service:KAFKA:payments.payment.captured.v1", "method": "KAFKA", "path": "payments.payment.captured.v1", "entry": "@acme/orders-service:PaymentEventsConsumer", "kind": "message", "protocol": "kafka", "module": "@acme/orders-service", "file": "apps/orders-service/src/payments/payment-events.consumer.ts", "line": 15 },
    { "id": "@acme/orders-service:KAFKA:payments.payment.failed.v1", "method": "KAFKA", "path": "payments.payment.failed.v1", "entry": "@acme/orders-service:PaymentEventsConsumer", "kind": "message", "protocol": "kafka", "module": "@acme/orders-service", "file": "apps/orders-service/src/payments/payment-events.consumer.ts", "line": 23 },
    { "id": "@acme/orders-service:CRON:0 */15 * * * *", "method": "CRON", "path": "0 */15 * * * *", "entry": "@acme/orders-service:ReconcileCron", "kind": "cron", "protocol": "schedule", "module": "@acme/orders-service", "file": "apps/orders-service/src/reconcile/reconcile.cron.ts", "line": 12 },
    { "id": "@acme/notification-worker:KAFKA:orders.order.created.v1", "method": "KAFKA", "path": "orders.order.created.v1", "entry": "@acme/notification-worker:OrderCreatedConsumer", "kind": "message", "protocol": "kafka", "module": "@acme/notification-worker", "file": "apps/notification-worker/src/orders/order-created.consumer.ts", "line": 14 },
    { "id": "@acme/notification-worker:RMQ:audit.user.created", "method": "RMQ", "path": "audit.user.created", "entry": "@acme/notification-worker:AuditConsumer", "kind": "message", "protocol": "rmq", "module": "@acme/notification-worker", "file": "apps/notification-worker/src/audit/audit.consumer.ts", "line": 11 },
    { "id": "@acme/notification-worker:QUEUE:email.send", "method": "QUEUE", "path": "email.send", "entry": "@acme/notification-worker:EmailProcessor", "kind": "queue", "protocol": "bullmq", "module": "@acme/notification-worker", "file": "apps/notification-worker/src/email/email.processor.ts", "line": 9 },
    { "id": "@acme/notification-worker:QUEUE:sms.send", "method": "QUEUE", "path": "sms.send", "entry": "@acme/notification-worker:SmsProcessor", "kind": "queue", "protocol": "bullmq", "module": "@acme/notification-worker", "file": "apps/notification-worker/src/sms/sms.processor.ts", "line": 9 },
    { "id": "@acme/notification-worker:CRON:0 8 * * *", "method": "CRON", "path": "0 8 * * *", "entry": "@acme/notification-worker:DigestScheduler", "kind": "cron", "protocol": "schedule", "module": "@acme/notification-worker", "file": "apps/notification-worker/src/digest/digest.scheduler.ts", "line": 10 }
  ],
  "nodes": [
    { "id": "@acme/api:UsersController", "name": "UsersController", "kind": "controller", "module": "@acme/api", "file": "apps/api/src/users/users.controller.ts" },
    { "id": "@acme/api:OrdersController", "name": "OrdersController", "kind": "controller", "module": "@acme/api", "file": "apps/api/src/orders/orders.controller.ts" },
    { "id": "@acme/api:AuthController", "name": "AuthController", "kind": "controller", "module": "@acme/api", "file": "apps/api/src/auth/auth.controller.ts" },
    { "id": "@acme/api:CatalogueResolver", "name": "CatalogueResolver", "kind": "resolver", "module": "@acme/api", "file": "apps/api/src/catalogue/catalogue.resolver.ts" },
    { "id": "@acme/api:EventsGateway", "name": "EventsGateway", "kind": "gateway", "module": "@acme/api", "file": "apps/api/src/events/events.gateway.ts" },
    { "id": "@acme/api:UsersService", "name": "UsersService", "kind": "service", "module": "@acme/api", "file": "apps/api/src/users/users.service.ts" },
    { "id": "@acme/api:OrdersService", "name": "OrdersService", "kind": "service", "module": "@acme/api", "file": "apps/api/src/orders/orders.service.ts" },
    { "id": "@acme/api:AuthService", "name": "AuthService", "kind": "service", "module": "@acme/api", "file": "apps/api/src/auth/auth.service.ts" },
    { "id": "@acme/api:CatalogueService", "name": "CatalogueService", "kind": "service", "module": "@acme/api", "file": "apps/api/src/catalogue/catalogue.service.ts" },
    { "id": "@acme/api:UserRepository", "name": "UserRepository", "kind": "repository", "module": "@acme/api", "file": "apps/api/src/users/user.repository.ts" },
    { "id": "@acme/api:OrdersGrpcClient", "name": "OrdersGrpcClient", "kind": "client", "module": "@acme/api", "file": "apps/api/src/orders/orders.grpc-client.ts" },
    { "id": "@acme/api:PaymentsHttpClientWithRetryAndCircuitBreaker", "name": "PaymentsHttpClientWithRetryAndCircuitBreaker", "kind": "client", "module": "@acme/api", "file": "apps/api/src/payments/payments.client.ts" },
    { "id": "@acme/api:apps/api/src/attachments/presign.ts#presignDownloadUrl", "name": "presignDownloadUrl", "kind": "function", "module": "@acme/api", "file": "apps/api/src/attachments/presign.ts" },
    { "id": "@acme/orders-service:OrdersGrpcController", "name": "OrdersGrpcController", "kind": "controller", "module": "@acme/orders-service", "file": "apps/orders-service/src/orders/orders.grpc.controller.ts" },